Rank,Song,Artist,Year,Lyrics,Source,Label,Ownership
29,eve of destruction,barry mcguire,1965,the eastern world it is explodin violence flarin bullets loadin youre old enough to kill but not for votin you dont believe in war but whats that gun youre totin and even the jordan river has bodies floatinbut you tell me over and over and over again my friend ah you dont believe were on the eve of destructiondont you understand what im trying to say cant you feel the fears that im feeling today if the button is pushed theres no running away therell be none to save with the world in a grave take a look around you boy its bound to scare you boyand you tell me over and over and over again my friend ah you dont believe were on the eve of destructionyeah my bloods so mad feels like coagulatin im sittin here just contemplatin i cant twist the truth it knows no regulation handful of senators dont pass legislationand marches alone cant bring integration when human respect is disintegratin this whole crazy world is just too frustratinand you tell me over and over and over again my friend ah you dont believe were on the eve of destructionthink of all the hate there is in red china then take a look around to selma alabama ah you may leave here for four days in space but when you return its the same old placethe poundin of the drums the pride and disgrace you can bury your dead but dont leave a trace hate your next door neighbor but dont forget to say graceand tell me over and over and over and over again my friend you dont believe were on the eve of destruction no no you dont believe were on the eve of destruction,1,Sad,Snehal
30,hang on sloopy,the mccoys,1965,hang on sloopy sloopy hang on hang on sloopy sloopy hang on sloopy lives in a very bad part of town and everybody there tries to put my sloopy down sloopy i dont care what your daddy do cause you know sloopy girl im in love with you and so im singing yeah yeah yeah yeah sloopy let your hair down girl let it run down on me sloopy let your hair down girl let it run down on me come on sloopy come on come on come on sloopy come on come on well come on sloopy come on come on well come on sloopy come on come on well it feels so good come on come on you know it feels so good come on come on well shake it shake it shake it sloopy come on come on well shake it shake it shake it yeah yeah yeah yeah yeah yeah,3,Party,Snehal
31,ticket to ride,the beatles,1965,i think im gonna be sad i think its today yeah the girl thats driving me mad is going away shes got a ticket to ride shes got a ticket to ride shes got a ticket to ride but she dont care she said that living with me is bringing her down yeah for she would never be free when i was around shes got a ticket to ride shes got a ticket to ride shes got a ticket to ride but she dont care i dont know why shes riding so high she ought to think twice she ought to do right by me before she gets to saying goodbye she ought to think twice she ought to do right by me i think im gonna be sad i think its today yeah the girl thats driving me mad is going away yeah oh shes got a ticket to ride shes got a ticket to ride shes got a ticket to ride but she dont care i dont know why shes riding so high she ought to think twice she ought to do right by me before she gets to saying goodbye she ought to think twice she ought to do right by me she said that living with me was bringing her down yeah for she would never be free when i was around oh shes got a ticket to ride shes got a ticket to ride shes got a ticket to ride but she dont care my baby dont care my baby dont care my baby dont care my baby dont care my baby dont care my baby dont care,3,Betray,Snehal
32,red roses for a blue lady,bert kaempfert,1965,i want some red roses for a blue lady mister florist take my order please we had a silly quarrel the other day i hope these pretty flowers chase her blues away i want some red roses for a blue lady send them to the sweetest gal in town and if they do the trick ill hurry back to pick your best white orchid for her wedding gown i want some red roses for a blue lady we had a silly quarrel the other day i hope these pretty flowers chase her blues away i want some red roses for a blue blue lady send them to the sweetest gal in town and if they do the trick ill hurry back to pick your best white orchid for her wedding gown your best white orchid for her wedding gown,3,Happy,Snehal
33,papas got a brand new bag,james brown,1965,come here sister papas in the swing he aint too hip about that new breed babe he aint no drag papas got a brand new bagcome here mama and dig this crazy scene hes not too fancy but his line is pretty clean he aint no drag papas got a brand new baghes doing the jerk hes doing the fly dont play him cheap cause you know he aint shy hes doing the monkey the mashed potatoes jump back jack see you later alligatorcome here sister papas in the swing he aint too hip now but i can dig that new breed babe he aint no drag hes got a brand new bag,1,Happy,Snehal
34,game of love,wayne fontana  the mindbenders,1965,the purpose of a man is to love a woman and the purpose of a woman is to love a man so come on baby lets start today come on baby lets play the game of love love la la la la la love it started long ago in the garden of eden when adam said to eve baby youre for me so come on baby lets start today come on baby lets play the game of love love la la la la la love come on baby cause the time is right love your daddy with all your might put your arms around me hold me tight play the game of love the purpose of a man is to love a woman and the purpose of a woman is to love a man so come on baby lets start today come on baby lets play the game of love love la la la la la love come on baby cause the time is right love your daddy with all your might put your arms around me hold me tight play the game of love the purpose of a man is to love a woman and the purpose of a woman is to love a man so come on baby lets start today come on baby lets play the game of love love la la la la la love the game of love baby the game of la la la la love the game of love baby the game of la la la la love the game of love baby,3,Romantic,Snehal
35,the name game,shirley ellis,1965,shirley ellis miscellaneous the name game the name game shirley  shirley shirley bo birley bonana fanna fo firley  fee fy mo mirley shirley lincoln  lincoln lincoln bo bincoln bonana fanna fo fincoln  fee fy mo mincoln lincoln come on everybody i say now lets play a game i betcha i can make a rhyme out of anybodys name the first letter of the name i treat it like it wasnt there but a b or an f or an m will appear and then i say bo add a b then i say the name and bonana fanna and a fo and then i say the name again with an f very plain  and a fee fy and a mo and then i say the name again with an m this time  and there isnt any name that i cant rhyme arnold  arnold arnold bo barnold bonana fanna fo farnold  fee fy mo marnold arnold but if the first two letters are ever the same  i drop them both and say the name like  bob bob drop the bs bo ob  for fred fred drop the fs fo red  for mary mary drop the ms mo ary  thats the only rule that is contrary okay now say bo bo  now tony with a b bony then bonana fanna fo bonana fanna fo then you say the name again with an f very plain fony then a fee fy and a mo fee fy mo then you say the name again with an m this time mony and there isnt any name that you cant rhyme every body do tony pretty good lets do billy very good lets do marsha a little trick with nick the name game,3,Happy,Snehal
36,i know a place,petula clark,1965,every day when the work is behind you and the shop and the store put the lock on the door just get away where your worries wont find you if you like well ill tell you moredont let the day get the better of you when the evening comes theres so much to do you better put on your best and wear a smile just come along with me awhile cuz i tell youi know a place where the music is fine and the lights are always low i know a place where we can goat the door theres a man who will greet you then you go downstairs to some tables and chairs soon im sure youll be tappin your feet because the beat is the greatest thereall around there are girls and boys its a swingin place a cellar full of noise its got an atmosphere of its own somehow you gotta come along right now cuz i tell youi know a place where the music is fine and the lights are always low i know a place where we can gowell all around there are girls and boys its a swingin place a cellar full of noise its got an atmosphere of its own somehow you gotta come along right now cuz i tell youi know a place where the music is fine and the lights are always low i know a place where we can goi know a place where we can go i know a place where the lights are low youre gonna love this place i know i know a place where we can go i know a place where the lights are low,1,Happy,Snehal
37,back in my arms again,the supremes,1965,ooooohall day long i hear my telephone ring friends calling giving their advice from the boy i love i should break away cause heartaches hell bring one dayi lost him once through friends advice but its not gonna happen twice cause all advice ever gotten me was really long and sleepless nights ooooohbut now hes back in my arms again right by my side i got him back in my arms again so satisfied ooooohits easy for friends to say let him go but im the one who needs him so its his love that makes me strong without him i cant go onthis time ill live my life at ease being happy loving whom i please and each time we make romance ill be thankful for a second chance ooooohcause hes back in my arms again right by my side i got him back in my arms again so satisfied ooooohhow can mary tell me what to do when she lost her love so true and flo she dont know cause the boy she loves is a romeoi listened once to my friends advice but its not gonna happen twice cause all advice ever gotten me was really long and sleepless nights ooooohi got him back in my arms again right by my side i got him back in my arms again so satisfied ooooohim satisfied so satisfied im satisfied im satisfied so satisfied,1,Romantic,Snehal
38,baby im yours,barbara lewis,1965,baby im yours and ill be yours until the stars fall from the sky yours until the rivers all run dry in other words until i die baby im yours and ill be yours until the sun no longer shines yours until the poets run out of rhyme in other words until the end of time im gonna stay right here by your side do my best to keep you satisfied nothing in this world can drive me away cause every day youll hear me say baby im yours and ill be yours until two and two is three yours until the mountain crumbles to the sea in other words until eternity baby im yours till the stars fall from the sky baby im yours till the rivers all run dry baby im yours till the poets run out of rhyme baby im yours,1,Romantic,Snehal
39,the jolly green giant,the kingsmen,1965,in the valley of the jolly heard about the jolly green giant potatoes hes so big and mean artichoke hearts well he stands there laughin with his hands on his hips and then he hits you with a can of beans well he lives down there in his valley brussels sprouts the cat stands tall and green spinach well he aint no prize and theres no women his size and thats why the cats so mean one day he left his valley pad i mean to say this cat was mad now lookin round he was incomprehensible and then he ran into an amazon well this changed his whole complexion broccoli he had never seen such a beautiful sight corn then he looked at her and she looked at him and she almost passed out from fright he looked at her thought what a dilly he touched her once she slapped him silly this was something he had never sensed he looked at her as she commenced now listen pal this aint no fluke i cant see goin with a big green kook youve heard about the jolly green giant   eggplant dont let his troubles cross your mind celery stalks he couldnt get sally so went back to his valley the cat was colorblind carrots canned beans,3,Happy,Snehal
40,hush hush sweet charlotte,patti page,1965,hush hush sweet charlotte charlotte dont you cry hush hush sweet charlotte hell love you till he diesoh hold him darling please hold him tight and brush the tear from your eyes you weep because you had a dream last night you dreamed that he said goodbyehe held two roses within his hand two roses he gave to you the red rose tells you of his passion the white rose his love so truehush hush sweet charlotte charlotte dont you cry hush hush sweet charlotte hell love you till he diesand every night after he shall die yes every night when hes gone the wind will sing to you this lullaby sweet charlotte was loved by johnhush hush sweet charlotte charlotte dont you cry hush hush sweet charlotte hell love you till he dies,1,Happy,Snehal
41,like a rolling stone,bob dylan,1965,once upon a time you dressed so fine threw the bums a dime in your prime didnt you people call say beware doll youre bound to fall you thought they were all kidding you you used to laugh about everybody that was hanging out now you dont talk so loud now you dont seem so proud about having to be scrounging your next mealhow does it feel how does it feel to be without a home like a complete unknown like a rolling stoneahh youve gone to the finest schools alright miss lonely but you know you only used to get juiced in it nobodys ever taught you how to live out on the street and now youre gonna have to get used to it you say you never compromise with the mystery tramp but now you realize hes not selling any alibis as you stare into the vacuum of his eyes and say do you want to make a dealhow does it feel how does it feel to be on your own with no direction home a complete unknown like a rolling stoneah you never turned around to see the frowns on the jugglers and the clowns when they all did tricks for you you never understood that it aint no good you shouldnt let other people get your kicks for you you used to ride on a chrome horse with your diplomat who carried on his shoulder a siamese cat aint it hard when you discovered that he really wasnt where its at after he took from you everything he could stealhow does it feel how does it feel to have on your own with no direction home like a complete unknown like a rolling stoneahh princess on a steeple and all the pretty people theyre all drinking thinking that theyve got it made exchanging all precious gifts but you better take your diamond ring you better pawn it babe you used to be so amused at napoleon in rags and the language that he used go to him he calls you you cant refuse when you aint got nothing you got nothing to lose youre invisible now youve got no secrets to concealhow does it feel ah how does it feel to be on your own with no direction home like a complete unknown like a rolling stone,1,Sad,Snehal
42,im telling you now,freddie and the dreamers,1965,"I'm telling you now I'm telling you right away I'll be saying for many a day I'm in love with you now I'm telling you now I'll say what you want to hear I'll be saying for many a year I'm in love with you now Do you think I'm foolin' When I say I love you? I love you Maybe you'll believe me when I'm finally through, blue, blue, blue I'm telling you now I know it's been said before Say you love me, and I will be sure I'm in love with you now I'm telling you now I'm telling you right away I'll be saying for many a day I'm in love with you now Do you think I'm foolin' When I say I love you? I love you Maybe you'll believe me when I'm finally through, blue, blue, blue I'm telling you now I know it's been said before Say you love me, and I will be sure 'm in love with you now I'm in love with you now I'm telling you now",NA,Romantic,Snehal
43,ferry cross the mersey,gerry and the pacemakers,1965,gerry miscellaneous ferry cross the mersey ferry cross the mersey gerry and pace makers gerry marsden life goes on day after day hearts torn in every way so ferry cross the mersey cause this lands the place i love and here ill stay people they rush everywhere each with their own secret care so ferry cross the mersey and always take me there the place i love people around every corner they seem to smile and say we dont care what your name is boy well never turn you away so ill continue to say here i always will stay so ferry cross the mersey cause this lands the place i love and here ill stay and here ill stay here ill stay,3,Sad,Snehal
44,just once in my life,the righteous brothers,1965,theres alot of things i want a lot of things that id like to be but girl i dont forsee a ragstoriches story for me theres just one little dream ive got to come true theres just one round ive gotta win i cant be a loser with youbaby baby once in my life let me get what i want girl dont let me down just once in my life let me hold on to one good thing i found dont let me down baby say that youll be stayincause i couldnt face a day if you werent here by my side if you went away then id be left without any pride ive given up on schemes cause all of them fell through ive given up so many things dont ask me to give up on youbaby baby once in my life let me get what i want girl dont let me down just once in my life let me hold on to one good thing i found dont let me down baby say that youll be stayinthat old pot of gold aint so easy to find but if you stand by me ill keep my peace of mind i cant give you the world but i ill work hard for you girl ill work hard evryday all my life so baby please dont leave me just do this for meonce in my life let me get what i want girl dont let me down just once in my life let me hold on to one good thing i found dont let me down baby say that youll be stayin,1,Betray,Snehal
45,the seventh son,johnny rivers,1965,NA,NA,,Snehal
46,im henery the eighth i am,hermans hermits,1965,NA,NA,,Snehal
47,a walk in the black forest,horst jankowski,1965,original is an instrumental music vocals recorded by salena jones the trees join hands and say hello and suddenly evrywhere we go the sun beams through in fun the  leaves form patterns like a heart and whisper forever never part  be true cause  i love you shadows write words of love across our path birds sing how lucky those whose love just grows together blades of grass stand on and on and chatter together in a calm  thats green and so serene a   memry of our walk   of love in a dream a stream goes by reflecting a message from the sky above and here and there we look around to see other lovers who have found  their way crickets tap out their symphony  in code rabbits run helter skelter finding shelter here and flowers swaying in the breeze look up to the branches of the trees and  sing as  birds take wing all this is true cause i love you,3,Romantic,Snehal
48,for your love,the yardbirds,1965,for your love for your love for your love id give you everything and more and thats for sure for your love id bring you diamond rings and things right to your door for your love to thrill you with delight id bring you diamonds bright double takes i will excite to make you dream of me at night for your love for your love for your love for your love for your love i would give the stars above for your love for your love i would give you all i could for your love for your love for your love id give the moon if it were mine to give for your love id give the stars and the sun for i live for your love to thrill you with delight id bring you diamonds bright double takes i will excite to make you dream of me at night for your love for your love for your love,3,Romantic,Snehal
49,california girls,the beach boys,1965,well east coast girls are hip i really dig those styles they wear and the southern girls with the way they talk they knock me out when im down there the midwest farmers daughter really makes you feel alright and the northern girls with the way they kiss they keep their boyfriends warm at night i wish they all could be california wish they all could be california i wish they all could be california girls the west coast has the sunshine and the girls all get so tan i dig a french bikini on hawiian island dollsby a palm tree in the sand i been all round this great big world and i seen all kinds of girls yeah but i couldnt wait to get back in the states back to the cutest girls in the world i wish they all could be california wish they all could be california i wish they all could be california girls i wish they all could be california wish they all could be california i wish they all could be california girls,3,Party,Snehal
50,go now,the moody blues,1965,weve already said goodbye since you gotta go oh youd better go now go now go now go now before you see me cry i dont want you to tell me just what you intend to do now cause how many times i have to tell you darlin darlin im still in love with you now woah weve already said so long i dont wanna see you go oh you had better go now go now go now go now dont you even try telling me that you really dont want me to end this way yeah but darlin darlin cant you see i want you to stay yeah since you gotta go oh you had better go now go now go now go now before you see me cry i dont want you to tell me just what you intend to do now but how many times do i have to tell you darlin darlin im still in love still in love with you now i dont wanna see you go but darlin youd better go now,3,Betray,Snehal
51,goldfinger,shirley bassey,1965,goldfinger hes the man the man with the midas touch a spiders touch such a cold finger beckons you to enter his web of sin but dont go ingolden words he will pour in your ear but his lies cant disguise what you fear for a golden girl knows when hes kissed her its the kiss of death from mister goldfinger pretty girl beware of his heart of gold this heart is coldgolden words he will pour in your ear but his lies cant disguise what you fear for a golden girl knows when hes kissed her its the kiss of death from mister goldfinger pretty girl beware of his heart of gold this heart is coldhe loves only gold only gold he loves gold he loves only gold only gold he loves gold,1,Betray,Snehal
52,down in the boondocks,billy joe royal,1965,down in the boondocks down in the boondocks people put me down cause thats the side of town i was born in i love her she loves me but i dont fit in her society lord have mercy on the boy from down in the boondocksevry night i watch the lights from the house up on the hill i love a little girl who lives up there and i guess i always will but i dont dare knock on her door cause her daddy is my boss man so i have to try to be content just to see her when ever i candown in the boondocks down in the boondocks people put me down cause thats the side of town i was born in i love her she loves me but i dont fit in her society lord have mercy on the boy from down in the boondocksdown in the boondocks down in the boondocksone fine day ill find the way to move from this old shack ill hold my head up like a king and i never never will look back until that morning ill work and slave and ill save evry dime but tonight shell have to steal away to see me one more timedown in the boondocks down in the boondocks people put me down cause thats the side of town i was born in i love her she loves me but i dont fit in her society lord have mercy on the boy from down in the boondocks lord have mercy on the boy from down in the boondocks lord have mercy on the boy from down in the boondocks,1,Sad,Snehal
53,baby the rain must fall,glenn yarbrough,1965,some men climb the mountains some men swim the seas some men fly above the sky they are what they must be baby the rain must fall baby the wind must blow wherever my heart leads me baby i must go baby i must go i do not love for silver i do not love for gold my heart is mine to give away it never will be sold baby the rain must fall baby the wind must blow wherever my heart leads me baby i must go baby i must go,3,Sad,Snehal
54,catch us if you can,the dave clark five,1965,here they come again mmm catch us if you can mmm time to get a move on mmm we will yell with all of our might catch us if you can catch us if you can catch us if you can catch us if you can now we gotta run mmm no more time for fun mmm when were getting angry mmm we will yell with all of our might catch us if you can catch us if you can catch us if you can catch us if you can yeah here they come again mmm catch us if you can mmm time to get a move on mmm we will yell with all of our might catch us if you can catch us if you can catch us if you can catch us if you can,3,Party,Snehal
55,eight days a week,the beatles,1965,ooh i need your love babe guess you know its true hope you need my love babe just like i need you hold me love me hold me love me i aint got nothing but love babe eight days a week love you every day girl always on my mind one thing i can say girl love you all the time hold me love me hold me love me i aint got nothing but love girl eight days a week eight days a week i love you eight days a week is not enough to show i care ooh i need your love babe guess you know its true hope you need my love babe just like i need you oh hold me love me hold me love me i aint got nothing but love babe eight days a week eight days a week i love you eight days a week is not enough to show i care love you every day girl always on my mind one thing i can say girl love you all the time hold me love me hold me love me i aint got nothing but love babe eight days a week eight days a week eight days a week,3,Romantic,Snehal
