Rank,Song,Artist,Year,Lyrics,Source,Label,Ownership
56,just a little,the beau brummels,1965,the beau brummels miscellaneous just a little just a little beau brummels ahhhhhhhhhhhhhhhhhhhhhhhh i cant stay yes i know you know i hate to go but goodbye love was sweet i was kind never mean so ill cry just a little cause i love you so and ill die just a little cause i have to go away cant you see how i feel when i say loves unreal so goodbye its been sweet even though incomplete so ill cry just a little cause i love you so and ill die just a little cause i have to go away instrumental interlude every night i still hear oh your sighs very near now its gone gone away as i once heard you say now ill cry just a little cause i love you so and ill die just a little cause i have to go away ahhhhhhhhhhhhhhhhhhhhhhhhh tmazanec1junocom or tom mazanec to humans,3,Betray,Snehal
57,you turn me on,ian whitcomb,1965,ian whitcomb miscellaneous you turn me on turn on song you turn me on ian whitcomb come on now honey you know you really turn me on come on now honey you know you really turn me on and when and when you do uh huh huh huh uh uh thats my song come on now baby come on and do the jerk with me come on now honey come on and do the jerk with me and if if you do uh huh huh huh uh uh thats my song break come on now baby you know you really turn me on ah come on now honey you know you really turn me on ah yeah and when and when you do uh huh huh huh uh uh thats my song lets go taken from the 45 from kay w simons,3,Party,Snehal
58,ill be doggone,marvin gaye,1965,well ill be doggone if i wouldnt work all day and ill be doggone if i wouldnt bring you my pay baby but if i ever caught you running around blowing my money all over this town then i wouldnt be doggone hey hey id be long gone then i wouldnt be doggone wouldnt be doggone id be long gone mmhmm id be long gone now hey hey heyill be doggone if you aint a pretty thing baby and ill be doggone if you aint warm as a breath of spring baby and if we live to be a hundred years old if you ever let that spring turn cold then i wouldnt be doggone wouldnt be doggone hey hey hey id be long gone id be long gone oh i wouldnt be doggone wouldnt be doggone baby id be long gone id be long gone mmhmm now did you hear me well now what i say oh believe mewell every woman should try to be whatever her man wants her to be and i dont want much all i want from you is for you to be true to meill be doggone if love aint a mans best friend oh baby oh baby and ill be doggone if you aint the loving end baby though i know you make me feel like nobody could if i ever found out that youre no good then i wouldnt be doggone wouldnt be wouldnt be wouldnt be doggone id be long gone id be long gone well i wouldnt be doggone wouldnt be doggone id be long gone id be long gone i wouldnt be doggone wouldnt be doggone catch me a train id be long gone no baby i wouldnt be doggone im gonna catch me a train,1,Betray,Snehal
59,save your heart for me,gary lewis  the playboys,1965,walk along the lake with someone new have yourself a summer fling or two but remember im in love with you and save your heart for me when the summer moon is on the rise and youre dancin under starlit skies please dont let the stars get in your eyes just save your heart for me when youre all alone far away from home someones gonna flirt with you i wont think its wrong if you play along just dont fall for someone new when the autumn winds begin to blow and the summertime is long ago youll be in my arms again i know so save your heart for me darlin save your heart for me please remember im in love with you so save your heart for me darlin save your heart for me,3,Romantic,Snehal
60,tired of waiting for you,the kinks,1965,so tired tired of waiting tired of waiting for you so tired tired of waiting tired of waiting for you i was a lonely soul i had nobody till i met you but you keeping me waiting all of the time what can i do its your life and you can do what you want do what you like but please dont keep me waiting please dont keep me waiting cuz im so tired tired of waiting tired of waiting for you so tired tired of waiting tired of waiting for you i was a lonely soul i had nobody till i met you but you keeping me waiting all of the time what can i do its your life and you can do what you want do what you like but please dont keep me waiting please dont keep me waiting cuz im so tired tired of waiting tired of waiting for you so tired tired of waiting tired of waiting for you for you for you,3,Sad,Snehal
61,count me in,gary lewis  the playboys,1965,if you need someone to count on count me in someone you can rely on through thick and thin when you start to count the ones that you might ever doubt if you think of counting me count me out when you count the ones that want you count me too and if im not first on your list count me blue just be sure you count on me and when the countins through count me madly in love with you if you need someone to count on when youre down and all your other friends youve lost count me found just be sure you count on me when youre down and out count me in through thick and thin or it dont count when you count the ones that want you count me too and if im not first on your list count me blue just be sure you count on me and when the countins through count me madly in love with you,3,Romantic,Snehal
62,all day and all of the night,the kinks,1965,and here come the kinks with all day and all of the night im not content to be with you in the daytime girl i want to be with you all of the time the only time i feel alright is by your side girl i want to be with you all of the time all day and all of the night all day and all of the night all day and all of the night i believe that you and me last forever oh yeah all day and nighttime yours leave me never the only time i feel alright is by your side girl i want to be with you all of the time all day and all of the night all day and all of the night oh come on i believe that you and me last forever oh yeah all day and nighttime yours leave me never the only time i feel alright is by your side girl i want to be with you all of the time all day and all of the night all day and all of the night time all day and all of the night,3,Romantic,Snehal
63,what the world needs now is love,jackie deshannon,1965,what the world needs now is love sweet love its the only thing that theres just too little of what the world needs now is love sweet love no not just for some but for everyonelord we dont need another mountain there are mountains and hillsides enough to climb there are oceans and rivers enough to cross enough to last till the end of timewhat the world needs now is love sweet love its the only thing that theres just too little of what the world needs now is love sweet love no not just for some but for everyonelord we dont need another meadow there are cornfields and wheat fields enough to grow there are sunbeams and moonbeams enough to shine oh listen lord if you want to knowwhat the world needs now is love sweet love its the only thing that theres just too little of what the world needs now is love sweet love no not just for some oh but just for ever every everyonewhat the world needs now is love sweet love oh is love what the world needs now is love sweet love oh is love what the world needs now is love sweet love oh is love,1,Happy,Snehal
64,its not unusual,tom jones,1965,its not unusual to be loved by anyone its not unusual to have fun with anyone but when i see you hanging about with anyone its not unusual to see me cry oh i wanna dieits not unusual to go out at any time but when i see you out and about its such a crime if you should ever want to be loved by anyone its not unusualit happens every day no matter what you say you find it happens all the time love will never do what you want it to why cant this crazy love be mineits not unusual to be mad with anyone its not unusual to be sad with anyone but if i ever find that youve changed at anytime its not unusual to find out that im in love with you whoa oh oh oh oh,1,Betray,Snehal
65,shes about a mover,sir douglas quintet,1965,well she was walking down the street looking fine as she could be hey hey well she was walking down that street looking fine as she can be well you know i love you baby wo yeah what id say shes about a mover shes about a mover shes about a mover shes about a mover hey hey hey hey what id say shes about a mover shes about a mover well you know i love you baby wo yeah what id say hey hey she strolled on up to me said hey big boy whats your name hey hey well she strolled on up to me she said hey big boy whats your name if you want love and conversation wo yeah what id say shes about a mover shes about a mover shes about a mover shes about a mover hey hey hey hey what id say shes about a mover shes about a mover if you want love and conversation wo yeah what id say hey hey well you know i love you baby wo yeah what id say hey hey come on do it to me baby yeah,5,Happy,Snehal
66,shake,sam cooke,1965,shake shake shake shakelistenlisten while i talk to you i tell you what were gonna do theres a new thing thats going around and ill tell you what theyre puttin downjust move your body all around and just shake oh mamma shake thats the way to do it shake oh youre looking good now shake yeah hashake it like a bowl of soup and make your body loop de loop put your hands on your hips and kinda let your backbone slip move your body like a whip and just shakeumm thats doing it shake yeah youre looking good now shake go on do it baby shake yeah ohha ringalingaling honey shakin is the latest thing and if you want to swing just loosen up them shouldersand if you want to really roll you got to do the thing with soul shake the shake with all your might oh if you do it do it right just make your body loose and light and kinda shake oh honeyshake hoo shake oh thats the way to do it shake ah ah ah ah ahyeahalrightoh youre doing it now honeycmon loosen up them shouldersif you want to really roll got to do the thing with soul shake the shake with all your might now if you do it do it right make your body loose and light and just shake oh i like to do it shake make me feel good now shake all gone baby shake dont be shy now shake dance with you mama shake dont do it baby shake oh yeah shake,1,Party,Snehal
67,wonderful world,hermans hermits,1965,i dont know much about my history now dont know much about biology dont know much about the science book now dont know much about the french i tookall i do know is i love you now and i wonder if you love me too ooh what a wonderful world this could beooh i dont know much about geography now dont know much about trigonometry now dont know much about the algebra dont know what a slide rule is forbut i do know one and one is two now and i wonder if you love me too ooh what a wonderful world this could bei dont claim to be an a student but thats what im trying to be but by being an a student baby look like i could win your love for medont know much about the history now oh now dont know much about biology i dont know much about the science book now dont know much about the good french i took ohall i do know is i love you now oh now and i wonder if you love me too ooh what a wonderful world this could begood lord i dont claim to be an a student but thats what im trying to be oh now but if i have to be an a student baby im gonna win your love for mei dont know much about geography now oh now dont know much about trigonometry dont know much about the algebra now dont know what a good slide rule is forbut i do know one and one is two now oh now and i wonder if you love me too ooh what a wonderful world this could beoh my my good lord ive been trying ive been trying ive been trying oh lord to understand the thing that ive been looking for,1,Sad,Snehal
68,nowhere to run,martha and the vandellas,1965,nowhere to run to baby nowhere to hide got nowhere to run to baby nowhere to hide its not love im runnin from its the heartaches i know will come cause i know youre no good for me but youve become a part of me everywhere i go your face i see every step i take you take with me nowhere to run to baby nowhere to hide got nowhere to run to baby nowhere to hide i know youre no good for me but free of you ill never be no each time as i speak into my heart you creep i wake up feelin sorry i met you hopin soon that ill forget you when i look in the mirror and comb my hair i see your face just asmilin there nowhere to run nowhere to hide love is my fate got nowhere to run to baby nowhere to hide i know youre no good for me but youve become a part of me how can i fight a love thats sugarsweet when its soul deep soul deep deep inside of me my love reaches so high i cant get over it its so wide i cant get around it no nowhere to run nowhere to hide love is my fate just cant get away from you baby no matter how i try i know youre no good for me but free of you ill never be nowhere to run to baby nowhere to hide got nowhere to run to baby nowhere to hide ive nowhere to run,3,Betray,Snehal
69,heart full of soul,the yardbirds,1965,sick at heart and lonely deep in dark despair thinking one thought only where is she tell me where and if she says to you she dont love me just give her my message tell her of my plea and i know well if she had me back again well i would never make her sad ive gotta heart full of soul and i know well if she had me back again well i would never make her sad ive gotta heart full of soul shes been gone such a long time longer than i can bear but if she says she wants me tell her that ill be there and if she says to you she dont love me just give her my message tell her of my plea and i know well if she had me back again well i would never make her sad ive gotta heart full of soul,3,Betray,Snehal
70,love potion no 9,the searchers,1965,i took my troubles down to madam ruth you know that gypsy with the gold capped tooth shes got a path down on thirtyfourth and vine sellin little bottles of love potion no 9 i told her that i was a flop with chicks ive been that way since nineteen fiftysix she looked at my palm and she made a magic sign she said what you need is love potion no 9 she bent down and turned around and gave me a wink she said im gonna make it up right here in the sink it smelled like turpentine and looked like indian ink i held my nose i closed my eyes i took a drink i didnt know if it was day or night i started kissin evry thing in sight but when i kissed a cop down at thirtyfourth and vine he broke my little bottle of love potion no 9 i held my nose i closed my eyes i took a drink i didnt know if it was day or night i started kissin evry thing in sight but when i kissed a cop down at thirtyfourth and vine he broke my little bottle of love potion no 9 love potion no 9 love potion no 9 love potion no 9,3,Happy,Snehal
71,laurie strange things happen,dickey lee,1965,last night at the dance i met laurie so lovely and warm an angel of a girl last night i fell in love with laurie strange things happen in this world as i walked her home she said it was her birthday i pulled her close and said will i see you anymore then suddenly she asked for my sweater and said that she was very very cold i kissed her goodnight at her door and started home then thought about my sweater and went right back instead i knocked at her door and a man appeared i told why id come then he said youre wrong son you werent with my daughter how can you be so cruel to come to me this way my laurie left this world on her birthday she died a year ago today a strange force drew me to the graveyard i stood in the dark i saw the shadows wave and then i looked and saw my sweater lyin there upon her grave strange things happen in this world,3,Sad,Snehal
72,baby dont go,sonny  cher,1965,sonny  cher baby dont go pretty baby please dont go i never had a mother i hardly knew my dad ive been in town for eighteen years youre the only boy ive had i cant stay maybe ill be back some day baby dont go pretty baby please dont go i love you so pretty baby please dont go i never had no money i bought at the second hand store the way this old town laughs at me i just cant take it no more i cant stay im gonna be a lady some day baby dont go pretty baby please dont go i love you so pretty baby please dont go when i get to the city my tears will all be dry my eyes will look so pretty no ones gonna know i cried yes im goin away maybe ill be back some day baby dont go maybe ill be back some day baby dont go,5,Sad,Snehal
73,it aint me babe,the turtles,1965,go away from my window leave at your own chosen speed im not the one you want babe im not the one you needyou say youre lookin for someone whos never weak but always strong to protect you an defend you whether you are right or wrongsomeone to open each and every door but it aint me babe no no no it aint me babe well it aint me youre lookin for babego lightly from the ledge babe go lightly on the ground im not the one you want babe ill only lead your downyou say youre lookin for someone wholl promise never to part someone to close his eyes to you someone to close his heartsomeone who will die for you an more but it aint me babe no no no it aint me babe well it aint me youre lookin for babe no it aint me youre lookin for babei said no no no it aint me babe i said no no no it aint me babe i said no no no it aint me babe i said no no no it aint me babe,1,Betray,Snehal
74,tell her no,the zombies,1965,and if she should tell you come closer and if she tempts you with her charmstell her no no no no no no no no no no no no no no no no no no no no no dont hurt me now for her love belongs to meand if she should tell you come closer and if she tempts you with her charmstell her no no no no no no no no no no no no no no no no dont take her love for your arms no no no no no dont hurt me now for her love belongs to mei know shes the kind of girl whod throw my love away but i still love her so dont hurt me now dont hurt me nowif she tells you i love you just remember she said that to metell her no no no no no no no no no no no no no no no no dont take her love from my arms no no no no no dont leave her now for her love belongs to me,1,Party,Snehal
75,i go to pieces,peter and gordon,1965,peter miscellaneous i go to pieces i go to pieces del shannon d shannon when i see her comin down the street i get so shaky and i feel so weak i tell my eyes look the other way but they dont seem to hear a word i say and i go to pieces and i wanna hide go to pieces and i almost die everytime my baby passes by i tell my arms theyll hold someone new another love that will be true but they dont listen they dont seem to care they reach for her but shes not there and i go to pieces and i wanna hide go to pieces and i almost die everytime my baby passes by i remember what she said when she said goodbye baby well meet again soon maybe but until we do all my best to you im so lonely i think about her only i go to places we used to go but i know shell never show she hurt me so much inside now i hope shes satisfied and i go to pieces and i wanna hide go to pieces and i almost die everytime my baby passes by go to pieces and i cry everytime my baby passes by go to pieces and i cry,3,Romantic,Snehal
76,red roses for a blue lady,vic dana,1965,vic dana miscellaneous red roses for a blue lady red roses for a blue lady artist vic dana peak billboard position  10 in 1965 words and music by sid tepper and roy bennett just edged out contemporary  11 hit by bert kaempfert soundly beat wayne newtons contemporary  23 version previously a  3 hit for vaughn monroe in 1949 i want some red roses for a blue lady mister florist take my order please we had a silly quarrel the other day i hope these pretty flowers chase her blues away i want some red roses for a blue lady send them to the sweetest gal in town and if they do the trick ill hurry back to pick your best white orchid for her wedding gown i want some red roses for a blue lady we had a silly quarrel the other day i hope these pretty flowers chase her blues away i want some red roses for a blue blue lady send them to the sweetest gal in town and if they do the trick ill hurry back to pick your best white orchid for her wedding gown your best white orchid for her wedding gown transcribed by ronald e hontz ronhontzworldnetattnet,3,Party,Snehal
77,dont just stand there,patty duke,1965,please dont just stand there come and kiss me like before please dont just stand there looking down at the floor if something is wrong give me just one little sign if theres someone else please tell me tell me what what what whats on your mind once when wed meet youd run to hold me tight life was so sweet until tonight please dont just stand there get it over if were through please dont just stand there while my heart breaks in two knowing i care how can you be so unkind please stop hurting me and help me tell me what what what whats on your mind if its a game i dont want to play it and if its goodbye why cant you just say it why make me cry like you do how can you be so unkind please start loving me or leave me tell me what what what whats on your mind dont just stand there tell me what what what whats on your mind dont just stand there tell me what what what whats on your mind dont just stand there tell me what what what whats on your mind,5,Betray,Snehal
78,the tracks of my tears,the miracles,1965,people say im the life of the party cause i tell a joke or two although i might be laughing loud and hearty deep inside im blue so take a good look at my face you know my smile looks out of place if you look closer its easy to trace the tracks of my tears i need you need you since you left me if you see me with another girl looking like im having fun although she may be cute shes just a substitute cause youre the permanent one so take a good look at my face you know my smile looks out of place if you look closer its easy to trace the tracks of my tears outside im masquerading inside my hope is fading im just a clown since you put me down my smile is my make up i wear since my breakup with you baby take a good look at my face you know my smile looks out of place if you look closer its easy to trace the tracks of my tears,3,Sad,Snehal
79,too many rivers,brenda lee,1965,i wish i could come back to you dear cause i know that you want me too but too much waters run under that old bridge theres too many rivers between me and youtheres too many rivers to cross dear too many dreams have been lost and theres too many long nights that ive turned and tossed theres too many rivers to crossnow dont think for a moment i blame only you we both peeled the fruit on the vine and when you try to put love back together theres always a few little pieces that you cant findyes theres too many rivers to cross dear and theres too many dreams that have been lost aah theres too many long nights that ive turned and ive tossed theres too many rivers to cross,1,Sad,Snehal
80,i like it like that,the dave clark five,1965,come on come on let me show you where its at ah come on come on let me show you where its at wow come on come on let me show you where its at i said the name of the place is i like it like that come on come on let me show you where its at ah come on come on let me show you where its at whoa i wanna show you come on let me show you where its at the name of the place is i like it like that they got a little place adown the track the name of the place is i like it like that you take sally and ill take sue and were gonna rock away all of our blues come on come on let me show you where its at oh come on come on let me show you where its at ah come on come on let me show you where its at the name of the place is i like it like that the last time i was down they lost my shoes they had some cat shoutin the blues the people was yellin and shoutin for more and all they kept sayin wasa go man go come on come on let me show you where its at ah come on come on let me show you where its at oh i wanna show you come on let me show you where its at i said the name of the place is i like it like that come on come on let me show you where its at ah come on come on let me show you where its at oh come on come on let me show you where its at the name of the place is i like it like that,3,Party,Snehal
81,little things,bobby goldsboro,1965,little things that you do  make me glad im in love with you little things that you say  make me glad that i feel this way the way you smile the way you hold my hand and when im down you always understand you know i love those little things i hear that you say when theres no one near little things that you do  let me know that your love is true when we walk you like to hold my hand and when we talk you tell me im your man you know i love those little things that i knew the little things you whispered in my ear i know there aint nobody else like you no one could do the little things you do little things that you do  make me glad im in love with you little things that you say  make me glad that i feel this way when we walk you like to hold my hand and when we talk you tell me im your man you know i love those little things that i knew the little things you whispered in my ear i know there aint nobody else like you,3,Romantic,Snehal
82,true love ways,peter and gordon,1965,peter miscellaneous true love ways true love ways buddy holly yes you know why why you and i will by and by know true love ways sometimes well sigh sometimes well cry and well know why just you and i know true love ways throughout the days our true love ways will bring us joy to share with those who really care sometimes well sigh sometimes well cry and well know why just you and i know true love ways,3,Party,Snehal
