Rank,Song,Artist,Year,Lyrics,Source,Label,Ownership
83,its the same old song,four tops,1965,youre sweet as a honey bee but like a honey bee stings youve gone and left my heart in pain all you left is our favorite song the one we danced to all night long it used to bring sweet memories of a tender love that used to benow its the same old song but with a different meaning since you been gone its the same old song but with a different meaning since you been gone i oh isentimental fool am i to hear a old love song and wanna cry cause the melody keeps haunting me reminding me how in love we used to be keep hearing the part that used to touch my heart saying together forever breaking up neverits the same old song but with a different meaning since you been gone but its the same old song but with a different meaning since you been goneprecious memories keep a lingering on every time i hear our favorite song now youre gone left this emptiness i only reminisce the happiness we spent we used to dance to the music make romance through the musicnow its the same old song but with a different meaning since you been gone its the same old song but with a different meaning since you been gone i oh iits the same old song but with a different meaning since you been gone its the same old song,1,Betray,Snehal
84,youve got your troubles,the fortunes,1965,NA,NA,,Snehal
85,hold what youve got,joe tex,1965,youd better hold on hold on to what youve got youd better hold on hold on to what youve got cause if you think nobody wants it just throw it away and you will see someone will have it before you can count one two three yes they will yes they will listen fellows you know its not all the time that a man can have a good woman a women he can call his very own a woman who will stay right there at home and mind the children while hes gone to work a woman who will have his dinner cooked when he comes home where some men make mistakes is when they go out and stay because they feel that no other man wants his woman but him but listen if you think no other man wants her just throw her away and you will see some men will have her before you can count one two three yes he will yes he willlisten girls this goes for you too because you know ive seen so many women whove had so many good men in life men who would stand by them through thick and thin men whod go to work everyday and bring home their hard earned pay men whod give their woman anything that their little hearts desired where some women make mistakes is when their men go out and let em play they would stay because they felt that no other woman wanted him but her listen if you think no other woman wants him just pitch him out in the street and you will see some woman will have your man before you can count one two three yes she will yes she will,1,Sad,Snehal
86,we gotta get out of this place,the animals,1965,midnight finds me cryin day time finds me cryin too ive got to get out of town this whole city just brings me down yeahgotta get away gotta get away gotta get awayi made a promise to you such a long time ago now baby now baby now baby now baby its time to make it come true yeah come through yeah come true yeah come through yeah come true yeahin this dirty old part of the city where the sun refuse to shine people tell me there aint no use in me trying no little girl youre so young and youre so pretty and one thing i know is true your going to be dead before your time is duesee my daddy in bed dying watched his hair been turning gray i know hes been working and slaving working and slaving slaving and working working yeah work yeah yeah yeah yeahwe gotta get out of this place if its the last thing we ever do we gotta get out of this place theres a better life dont you know dont you know man dont you know dont you know dont you knowwell well well time brings about a change time on the clock on the wall brings about a change yeah all of his life hes been slaving all of the life hes been workingfor what for what for what for what give it up give it up give it up give it up yeahsee my daddy in bed dying watched his hair been turning gray i know hes been working and slaving and slaving and working and working and slaving working yeah work yeah yeah yeah yeahwe gotta get out of this place if its the last thing we ever do we gotta get out of this place theres a better life dont you know dont you know dont you knowtake me take me take mewe gotta get out of this place if its the last thing we ever do we just gotta get out of this place theres a better life theres a better world theres a better way dont you know dont you know dont you knowwe gotta get out of this place if its the last thing we ever do we gotta get out of this place theres a better world dont you know dont you know dont you know i want to get you out of this placeout of this place out of this place yeah yeah yeah,1,Sad,Snehal
87,laugh laugh,the beau brummels,1965,i hate to say it but i told you so dont mind my preachin to you i said dont trust em baby now you know you dont learn evrything there is to know in school wouldnt believe me when i gave advice i said that he was a tease if you want help you better ask me nice so be sincere convince me with a pretty please laugh laugh i thought id die it seemed so funny to me laugh laugh you met a guy who taught you how it feels to be lonely oh so lonely dont think im bein funny when i say you got just what you deserve i cant help feeling you found out today you thought you would you could you had a lot of nerve wont say im sorry for the things i said im glad he packed up to go you kept on braggin he was yours instead found you dont know evrything there is to know laugh laugh i thought id die it seemed so funny to me laugh laugh you met a guy who taught you how it feels to be lonely oh so lonely before i go i got to say one thing dont close your ears to me take my advice and you find out that he is just another guy wholl cause you misery dont say you cant get any boy to call dont be so smug or else youll find you cant get any boy atall youll wind up an old lady sittin on the shelf laugh laugh i thought id die it seemed so funny to me laugh laugh you met a guy who taught you how it feels to be lonely oh so lonely,3,Sad,Snehal
88,the last time,the rolling stones,1965,well i told you once and i told you twice but ya never listen to my advice you dont try very hard to please me with what you know it should be easy well this could be the last time this could be the last time maybe the last time i dont know oh no oh no well im sorry girl but i cant stay feelin like i do today its too much pain and too much sorrow guess ill feel the same tomorrow well this could be the last time this could be the last time maybe the last time i dont know oh no oh no well i told you once and i told you twice that someone will have to pay the price but heres a chance to change your mind cuz ill be gone a long long time well this could be the last time this could be the last time maybe the last time i dont know oh no oh no well this could be the last time,3,Sad,Snehal
89,do you believe in magic,the lovin spoonful,1965,do you believe in magic in a young girls heart how the music can free her whenever it starts and its magic if the music is groovy it makes you feel happy like an oldtime movie ill tell you about the magic and itll free your soul but its like trying to tell a stranger bout rock and roll if you believe in magic dont bother to choose if its jug band music or rhythm and blues just go and listen itll start with a smile it wont wipe off your face no matter how hard you try your feet start tapping and you cant seem to find how you got there so just blow your mind if you believe in magic come along with me well dance until morning til theres just you and me and maybe if the music is right ill meet you tomorrow sort of late at night and well go dancing baby then youll see how the magics in the music and the musics in me yeah do you believe in magic yeah believe in the magic of a young girls soul believe in the magic of rock and roll believe in the magic that can set you free ohh talking bout magic do you believe like i believe do you believe in magic do you believe like i believe do you believe believer do you believe like i believe do you believe in magic fade,3,Happy,Snehal
90,all i really want to do,cher,1965,now i aint lookin to compete with you beat on cheat on mistreat you simplify you classify you deny defy mystify youall i really want to do is baby be friends with you baby be friends with younow i aint lookin to fight with you frighten you or uptighten you drag you down or drain you down chain you down or bring you downall i really want to do is baby be friends with you baby be friends with youi aint lookin to block you up dock or rock or lock you up analyze you categorize you finalize or advertise youall i really want to do yeah is baby be friends with you baby be friends with youi dont want to straightface you race or chase or track or trace you or disgrace you or displace you or define you or confine youall i really want to do yeah is baby be friends with you baby be friends with younow i dont want to meet your kin make you spin or do you in or select you or dissect you or inspect you or reject youall i really want to do is baby be friends with you baby be friends with you,1,Party,Snehal
91,take me back,little anthony and the imperials,1965,take me back im beggin please take me back im on my knees for you to scold me hurt me hold me darling take me back when you belonged to me i had a jealous mind too late i learned that you were not the cheating kind take me back im beggin please take me back im on my knees for you to scold me hurt me hold me darling take me back my jealous eyes have learned to take a look or two they were too blind to see that i was losing you take me back im beggin please take me back im on my knees for you to scold me hurt me hold me darling take me back they say you live and learn and though ive tried before i promise never to be jealous any more take me back im beggin please take me back im on my knees for you to scold me hurt me hold me darling take me back,3,Betray,Snehal
92,i want candy,the strangeloves,1965,i know a girl whos soft and sweet shes so fine she cant be beat got everything that i desire sets the summer sun on fire i want candy i want candy go to see her with her hair hung down aint no finer girl in town candys just what the doctor ordered shes so sweet she makes my mouth water i want candy i want candy i want candy i want candy i want candy i want candy candy on the beach theres nothing better but i like candy when its wrapped in a sweater some day soon ill make her mine then ill have candy all the time i want candy i want candy hey hey hey hey hey hey hey hey hey,3,Party,Snehal
93,ooo baby baby,the miracles,1965,ooo la la la la i did you wrong my heart went out to play but in the game i lost you what a price to pay hey im crying ooo baby baby ooo baby baby mistakes i know ive made a few but im only human youve made mistakes too im crying ooo baby baby ooo baby baby im just about at the end of my rope but i cant stop trying i cant give up hope cause i feel that one day ill hold you near whisper i still love you until that day is here im crying ooo baby baby ooo baby baby ooo baby baby ooo baby baby ooo,3,Betray,Snehal
94,laugh at me,sonny bono,1965,why cant i be like any guy why do they try to make me run son of a gun now what do they care about the clothes i wear why get their kicks from making fun yeah this worlds got a lot of space and if they dont like my face it aint me thats going anywhere no so i dont care let em laugh at me if thats the fare i have to pay to be free then baby laugh at me and ill cry for you and ill pray for you and ill do all the things that the man upstairs says to do ill do em for you ill do em ill do em all for you its gotta stop someplace its gotta stop sometime ill make sure that shes mine and maybe the next guy that dont wear a silk tie he can walk by and say hi say hi instead of why instead of why instead of why babe instead of why what did i do to you i dont know what to do,3,Party,Snehal
95,treat her right,roy head,1965,i wanna tell you a story  every man oughta know  if you want a little lovin you gotta start real slow  shes gonna love you tonight now  if you just treat her right now  squeeze her real gentle  gotta make her feel good  tell her that you love her  like you know you should  so if you dont treat her right  she wont love you tonight  if you practice my method  just as hard as you can  youre gonna get a reputation  as a lovin man  and youll be glad every night  that you treated her right  music to fade,3,Romantic,Snehal
96,the race is on,jack jones,1965,i feel tears well in up from deep inside like my hearts goin to break and a stab of loneliness sharp and painful that i may never shake you might say that i was takin it hard since you gave me the final goodbye but dont you wager that ill hide the sorrow when i may break right down and cry now the race is on and here comes pride up the backstretch heartaches are goin to the inside my tears are holdin back theyre tryin not to fall my hearts out of the runnin true loves scratched for anothers sake the race is on and it looks like heartaches and the winner loses all one day i ventured in love never once suspectin what the final results would be how i lived in fear of wakin up each mornin and find that youre gone from me theres ache and pain in my heart for the name of the one that ill never replaced somebody new came up to win her and i came out in second place now the race is on and here comes pride up the backstretch heartaches are goin to the inside my tears are holdin back theyre tryin not to fall my hearts out of the runnin true loves scratched for anothers sake the race is on and it looks like heartaches and the winner loses all,3,Betray,Snehal
97,im a fool,dino desi  billy,1965,NA,NA,,Snehal
98,the boy from new york city,the ad libs,1965,oo ah oo ah oo oo kitty tell us about the boy from new york city oo ah oo ah come on kitty tell us about the boy from new york city hes kinda tall hes really fine yeah yeah someday i hope to make him mine all mine yeah yeah and hes neat and oh so sweet and the way he looked at me just swept me off my feet yeah yeah oo ee you oughta come and see how he walks yeah yeah and he talks oo ah oo ah oo oos kitty tell us about the boy from new york city oo ah oo ah come on kitty tell us about the boy from new york city hes really down and hes no clown yeah yeah he has the finest penthouse ive ever seen in town yeah yeah and hes cute in his mohair suit and he keeps his pockets full of spending loot yeah yeah oo ee yeah were all right yeah oo oo evry time he says he loves me chills run down my spine evry time he wants to kiss me he makes me feel so fine thats him alright hes the boy from new york city we call him jill were all right oo ah oo ah kitty tell us about the boy from new york city oo ah oo ah kitty tell us about the boy from new york city,3,Party,Snehal
99,keep searchin well follow the sun,del shannon,1965,no one will understand what ive gotta do ive gotta find a place to hide with my baby by my side shes been hurt so much they treat her mean and cruel they try to keep us far apart theres only one thing left we can dowe gotta keep searchin searchin find a place to hide searchin searchin shell be by my side if we gotta keep on the run well follow the sunah weeooh follow the sunah weeoohdoesnt matter doesnt matter what people might say shes mine and im gonna take her anywaygotta keep searchin searchin find a place to stay searchin searchin every night and day if we gotta keep on the run well follow the sunah weeooh follow the sunah weeooh,1,Romantic,Snehal
100,how sweet it is to be loved by you,marvin gaye,1965,how sweet it is to be loved by you yes baby how sweet it is to be loved by youooh baby i needed the shelter of someones arms and there you were i needed someone to understand my ups and downs and there you werewith sweet love and devotion deeply touching my emotioni want to stop stop and thank you baby i just want to stop and thank you baby hey nowhow sweet it is to be loved by you oh baby how sweet it is to be loved by you yes it isclose my eyes at night and wonder what would i be without you in my life everything was just a bore all the things i did seems ive done em before but you brightened up all of my days with a love so sweet in so many waysi want to stop stop and thank you baby i want to stop stop and thank you baby yeah how sweet it is to be loved by you oh yes it is how sweet it is to be loved by you yes it is babyyou were better to me than ive been to myself for me theres you and nobody elsestop stop and thank you baby i want to stop stop and thank you baby oh how sweet it is to be loved by you tell the truth baby how sweet it is to be loved by you well its like sugar in my soul how sweet it is to be loved by you oh yes it is,1,Romantic,Snehal
1,ballad of the green berets,ssgt barry sadler,1966,NA,NA,,Snehal
2,cherish,the association,1966,cherish is the word i use to describe all the feeling that i have hiding here for you inside you dont know how many times ive wished that i had told you you dont know how many times ive wished that i could hold you you dont know how many times ive wished that i could mold you into someone who could cherish me as much as i cherish you perish is the word that more than applies to the hope in my heart each time i realize that i am not gonna be the one to share your dreams that i am not gonna be the one to share your schemes that i am not gonna be the one to share what seems to be the life that you could cherish as much as i do yours oh im beginning to think that man has never found the words that could make you want me that have the right amount of letters just the right sound that could make you hear make you see that you are drivin me out of my mind oh i could say i need you but then youd realize that i want you just like a thousand other guys whod say they loved you with all the rest of their lies when all they wanted was to touch your face your hands and gaze into your eyes cherish is the word i use to describe all the feeling that i have hiding here for you inside you dont know how many times ive wished that i had told you you dont know how many times ive wished that i could hold you you dont know how many times ive wished that i could mold you into someone who could cherish me as much as i cherish you and i do cherish you and i do cherish you cherish is the word,3,Happy,Snehal
3,youre my soul and inspiration,the righteous brothers,1966,girl i cant let you do this let you walk away girl how can i live through this when youre all i wake up for each daybaby youre my soul and my lifes inspiration youre all ive got to get me by youre my soul and my inspiration without you baby what good am ii never had much goin but at least i had you how can you walk out knowin i aint got nothin left if you dobaby youre my soul and my lifes inspiration youre all ive got to get me by youre my soul and my inspiration without you baby what good am i oh what good am ibaby i cant make it withoutcha and im tellin ya honey youre my reason for laughin for cryin for livin and for dyinbaby i cant make it without you please im beggin you baby if you go it will kill me i swear it girl i just cant bear ityoure my soul and my lifes inspiration youre all ive got to get me by youre my soul and my inspiration without you baby what good am i oh what good am iyoure my soul and my lifes inspiration youre all ive got all ive got to get by soul inspiration oh baby im beggin you baby,1,Romantic,Snehal
4,reach out ill be there,the four tops,1966,now if you feel that you cant go on because all of your hope is gone and your life is filled with much confusion until happiness is just an illusion and your world around is crumblin down darling reach out come on girl reach on out for me reach out reach out for me ill be there with a love that will shelter you ill be there with a love that will see you throughwhen you feel lost and about to give up cause your best just aint good enough and you feel the world has grown cold and youre drifting out all on your own and you need a hand to hold darling reach out come on girl reach out for me reach out reach out for me ill be there to love and comfort you and ill be there to cherish and care for you ill be there with a love that will see you through ill be there to love and comfort youi can tell the way you hang your head youre without love and now youre afraid and through your tears you look around but theres no peace of mind to be found i know what youre thinkin youre alone now no love of your own but darling reach out come on girl reach out for me reach out just look over your shoulder ill be there to give you all the love you need and ill be there you can always depend on me,1,Sad,Snehal
5,96 tears,the mysterians,1966,the mysterians miscellaneous 96 tears too many teardrops for one heart to be cryin too many teardrops for one heart to carry on youre way on top now since you left me youre always laughin way down at me but watch out now im gonna get there well be together for just a little while and then im gonna put you way down here and youll start cryin ninetysix tears cry cry and when the sun comes up ill be on top youll be way down there lookin up and i might wave come up here but i dont see you wavin now im way down here wonderin how im gonna get you but i know now ill just cry cry ill just cry too many teardrops for one heart to be cryin too many teardrops for one heart to carry on youre gonna cry  ninetysix tears youre gonna cry  ninetysix tears youre gonna cry  cry cry cry now youre gonna cry  cry cry cry ninetysix tears  cmon and lemme hear you cry now ninetysix tears whoo   i wanna hear you cry night and day yeah all night long uhninetysix tears    cry cry cry cmon baby let me hear you cry now all night long uhninetysix tears  yeah  cmon now uhninetysix tears fade,3,Betray,Snehal
6,last train to clarksville,the monkees,1966,take the last train to clarksville and ill meet you at the station you can be be here by four thirty cause ive made your reservation dont be slow oh no no no oh no no no cause im leavin in the morning and i must see you again well have one more night together til the morning brings my train and i must go oh no no no oh no no no and i dont know if im ever coming home take the last train to clarksville ill be waiting at the station well have time for coffee flavored kisses and a bit of conversation oh no no no oh no no no take the last train to clarksville now i must hang up the phone i cant hear you in this noisy railroad station all alone im feelin low oh no no no oh no no no and i dont know if im ever coming home take the last train to clarksville and ill meet you at the station you can be be here by four thirty cause i made your reservation dont be slow oh no no no oh no no no and i dont know if im ever coming home take the last train to clarksville take the last train to clarksville take the last train to clarksville take the last train to clarksville,3,Happy,Snehal
7,monday monday,the mamas  the papas,1966,monday monday so good to me monday morning it was all i hoped it would be oh monday morning monday morning couldnt guarantee that monday evening you would still be here with me monday monday cant trust that day monday monday sometimes it just turns out that way oh monday morning you gave me no warning of what was to be oh monday monday how could you leave and not take me every other day every other day every other day of the week is fine yeah but whenever monday comes but whenever monday comes you can find me crying all of the time monday monday so good to me monday morning it was all i hoped it would be but monday morning monday morning couldnt guarantee that monday evening you would still be here with me every other day every other day every other day of the week is fine yeah but whenever monday comes but whenever monday comes you can find me crying all of the time monday monday cant trust that day monday monday it just turns out that way oh monday monday wont go away monday monday its here to stay oh monday monday oh monday monday oh,3,Sad,Snehal
8,you cant hurry love,the supremes,1966,i need love love to ease my mind i need to find find someone to call mine but mama saidyou cant hurry love no you just have to wait she said love dont come easy its a game of give and takeyou cant hurry love no you just have to wait you got to trust give it time no matter how long it takesbut how many heartaches must i stand before i find a love to let me live again right now the only thing that keeps me hangin on when i feel my strength yeah is almost gone i remember mama saidyou cant hurry love no you just have to wait she said love dont come easy its a game of give and takehow long must i wait how much more can i take before loneliness will cause my heart heart to breakno i cant bear to live my life alone i grow impatient for a love to call my own but when i feel that i i cant go on these precious words keeps me hangin on i remember mama saidyou cant hurry love no you just have to wait she said love dont come easy its a game of give and takeyou cant hurry love no you just have to wait she said trust give it time no matter how long it takesno love love dont come easy but i keep on waiting anticipating for that soft voice to talk to me at night for some tender arms to hold me tighti keep waiting i keep on waiting but it aint easy it aint easy but mama saidyou cant hurry love no you just have to wait she said to trust give it time no matter how long it takesyou cant hurry love no you just have to wait she said love dont come easy its a game of give and take,1,Happy,Snehal
